name,url
Кофе Руанда Южная Провинция от Хороший Тигр,https://specialty.ru/coffee/kofe-ruanda-yuzhnaya-provintsiya_1/
Кофе Эфиопия Лиму от Хороший Тигр,https://specialty.ru/coffee/kofe-efiopiya-limu_1/
Кофе Колумбия Розовый Бурбон от Хороший Тигр,https://specialty.ru/coffee/kofe-kolumbiya-rozovyy-burbon/
Эспрессо от Specialty,https://specialty.ru/coffee/espresso-ot-specialty/
Кофе Вьетнам Тхай нгуен от Neva Coffee Roasters,https://specialty.ru/coffee/kofe_vietnam_thai_nguyen/
Кофе Бразилия Суль-де-Минас Conquista Capoeirinha от BolsheCoffee Roasters,https://specialty.ru/coffee/kofe_brazil_sul_du_minas_conquista_capoeirinha_1/
Кофе Бразилия Серрадо Минейро Кооператив Кокомар от Brew Me,https://specialty.ru/coffee/kofe_brazil_cerrado_mineiro_kokomar_cooperative/
Кофе Колумбия Уила Супремо от Neva Coffee Roasters,https://specialty.ru/coffee/kofe_colombia_huila_supremo/
Капсулы Nespresso Эфиопия Гедеб,https://specialty.ru/coffee/kapsuly_ethiopia_gedeb_1/
Капсулы Nespresso Бразилия Серрадо Минейро,https://specialty.ru/coffee/kapsuly_brazil_cerrado_mineiro_1/
Кофе Бразилия Суль-де-Минас SHB от ,https://specialty.ru/coffee/kofe-braziliya-sul-de-minas-shb/
Кофе Бразилия Моджиана от Just Coffee,https://specialty.ru/coffee/kofe_brazil_mogiana_2/
Кофе Колумбия Антьокия Супремо от Just Coffee,https://specialty.ru/coffee/kofe_colombia_antioquia_supremo_4/
Кофе Гондурас Комаягуа Ла Эсмеральда от BolsheCoffee Roasters,https://specialty.ru/coffee/kofe-gonduras-komayagua-la-esmeralda/
Кофе Бразилия Суль-де-Минас GTFC от BolsheCoffee Roasters,https://specialty.ru/coffee/kofe_brazil_sul_du_minas_kooshupe_gtfc/
Кофе Бразилия Серрадо Минейро Пиберри от Baltic Coffee Roasters,https://specialty.ru/coffee/kofe-braziliya-serrado-mineyro-piberri/
Кофе Эфиопия Йиргачефф от MIKALE,https://specialty.ru/coffee/kofe-efiopiya-yirgacheff_6/
Кофе Гватемала Акатенанго от Tasty Coffee,https://specialty.ru/coffee/kofe-gvatemala-akatenango_1/
Кофе Бразилия Моджиана от Tasty Coffee,https://specialty.ru/coffee/kofe-braziliya-modzhiana_5/
Кофе Коста Рика Таррасу Лос Пинос от Tasty Coffee,https://specialty.ru/coffee/kofe-kosta-rika-tarrasu-los-pinos/
Кофе Коста Рика Брунка от Tasty Coffee,https://specialty.ru/coffee/kofe-kosta-rika-brunka/
Кофе Колумбия Декаф от August Coffee,https://specialty.ru/coffee/kofe-kolumbiya-dekaf_3/
Дрип-пакеты Индонезия Микс,https://specialty.ru/coffee/drip-pakety-indoneziya-miks/
Дрип-пакеты Микс На месяц,https://specialty.ru/coffee/drip-pakety-miks-na-mesyats_1/
Дрип-пакеты Микс 1,https://specialty.ru/coffee/drip-pakety-miks-1_8/
Дрип-пакеты Колумбия Уила Эль Дивизио,https://specialty.ru/coffee/drip-pakety-kolumbiya-uila-el-divizio/
Кофе Бурунди Муйинга Бусаса от Kanga Roasters,https://specialty.ru/coffee/kofe-burundi-muyinga-busasa/
Кофе Эфиопия Нэнсебо Западный Арси Бале от Kanga Roasters,https://specialty.ru/coffee/kofe-efiopiya-nensebo-zapadnyy-arsi-bale/
Кофе Кения Мурарандия АА от DOBRO COFFEE MICROROASTERS,https://specialty.ru/coffee/kofe-keniya-murarandiya-aa/
Кофе Колумбия Толима Клубника от MIKALE,https://specialty.ru/coffee/kofe-kolumbiya-tolima-klubnika/
Кофе Эфиопия Сидама Демби от MIKALE,https://specialty.ru/coffee/kofe-efiopiya-sidama-dembi/
Кофе Колумбия Рисаральда Буэнависта от MIKALE,https://specialty.ru/coffee/kofe-kolumbiya-risaralda-buenavista_1/
Кофе Колумбия Толима Виноград от MIKALE,https://specialty.ru/coffee/kofe-kolumbiya-tolima-vinograd/
Дрип-пакеты Ассорти 1,https://specialty.ru/coffee/drip-pakety-assorti-1/
Дрип-пакеты Гондурас Ла Эсмиральда,https://specialty.ru/coffee/drip-pakety-gonduras-esmiralda/
Дрип-пакеты Бразилия Мантикейра,https://specialty.ru/coffee/drip-pakety-braziliya-mantikeyra/
Дрип-пакеты Кения Мурарандия Гатуя,https://specialty.ru/coffee/drip-pakety-keniya-murarandiya-gatuya/
Дрип-пакеты Уганда Зесуи,https://specialty.ru/coffee/drip-pakety-uganda-zesui/
Дрип-пакеты Индонезия Адэна Флорэс,https://specialty.ru/coffee/drip-pakety-indoneziya-adena-flores/
Кофе Руанда Ньямашеке Килимби от Yankee Sierra,https://specialty.ru/coffee/kofe-ruanda-nyamasheke-kilimbi/
"Дрипы Колумбия, Эфиопия, Руанда",https://specialty.ru/coffee/dripy-koluibiya-efiopiya-ruanda/
Кофе Бурунди Муйинга нат от DOBRO COFFEE MICROROASTERS,https://specialty.ru/coffee/kofe-burundi-muyinga-nat/
Кофе Индонезия Фринса Лактик хани от DOBRO COFFEE MICROROASTERS,https://specialty.ru/coffee/kofe-indoneziya-frinsa-laktik-khani/
Дрип-пакеты Колумбия Чаморро Декаф,https://specialty.ru/coffee/drip-pakety-kolumbiya-chamorro-dekaf/
"Кофе бленд Панама Кокле, Кения Меру от Yankee Sierra",https://specialty.ru/coffee/kofe-panama-heirloom-keniya-masai/
Кофе Индонезия Суматра Адена Линтонг от BolsheCoffee Roasters,https://specialty.ru/coffee/kofe-indoneziya-sumatra-adena-lintong/
Кофе Индонезия Адэна Флорес от BolsheCoffee Roasters,https://specialty.ru/coffee/kofe-indoneziya-adena-flores/
Аниме-дрипы,https://specialty.ru/coffee/anime-dripy/
Ассорти дрип-пакетов,https://specialty.ru/coffee/assorti-drip-paketov/
Кофе Индонезия Фринса от ,https://specialty.ru/coffee/kofe-indoneziya-frinsa_1/
Дрип-пакеты Колумбия Анджело Соса,https://specialty.ru/coffee/drip-pakety-kolumbiya-andzhelo-sosa/
Кофе Бразилия Суль-Де-Минас от Baltic Coffee Roasters,https://specialty.ru/coffee/kofe-braziliya-sul-de-minas_7/
Кофе Мексика Чьяпас от Baltic Coffee Roasters,https://specialty.ru/coffee/kofe-meksika-chyapas/
Кофе Кения Меру от Baltic Coffee Roasters,https://specialty.ru/coffee/kofe-keniya-meru/
Кофе Бразилия Фазенда Топазо от Baltic Coffee Roasters,https://specialty.ru/coffee/kofe-braziliya-fazenda-topazo/
Кофе Кения Мара Эстейт от Baltic Coffee Roasters,https://specialty.ru/coffee/kofe-keniya-mara-esteyt/
Кофе Индонезия Фринса Эстейт от Baltic Coffee Roasters,https://specialty.ru/coffee/kofe-indoneziya-frinsa-esteyt/
Дрип-пакеты Кения Меру,https://specialty.ru/coffee/drip-pakety-keniya-meru/
Кофе Бразилия Пиберри от Мануфактура кофе,https://specialty.ru/coffee/kofe-braziliya-piberri/
Кофе Бразилия Суль-де-Минас Сантос от Мануфактура кофе,https://specialty.ru/coffee/kofe-braziliya-sul-de-minas-santos/
Кофе Эфиопия Иргачеффе от Мануфактура кофе,https://specialty.ru/coffee/kofe-efiopiya-irgacheffe/
Кофе Мексика Чьяпас Муксбал от Мануфактура кофе,https://specialty.ru/coffee/kofe-meksika-chyapas-muksbal/
Кофе Колумбия Супремо от Мануфактура кофе,https://specialty.ru/coffee/kofe-kolumbiya-supremo/
Кофе Эфиопия Кочере от Мануфактура кофе,https://specialty.ru/coffee/kofe-efiopiya-kochere/
Кофе Бразилия Топазо от Мануфактура кофе,https://specialty.ru/coffee/kofe-braziliya-topazo/
Кофе Кения Мара от Мануфактура кофе,https://specialty.ru/coffee/kofe-keniya-mara/
Кофе Индонезия Фринса Эстейт от Мануфактура кофе,https://specialty.ru/coffee/kofe-indoneziya-frinsa-esteyt_1/
Дрип-бокс БРЮБЕРРИМОР 15,https://specialty.ru/coffee/drip-boks-bryuberrimor-15/
Кофе Эфиопия Оромия от August Coffee,https://specialty.ru/coffee/kofe-efiopiya-oromiya_3/
Дрип-пакеты Кения Киамбу,https://specialty.ru/coffee/drip-pakety-keniya-kiambu_1/
Кофе Коста Рика Таррасу Трес Эрманас от MIKALE,https://specialty.ru/coffee/kofe-kosta-rika-tarrasu-tres-ermanas/
Кофе Индонезия Суматра Керинчи Гр. 1 от MIKALE,https://specialty.ru/coffee/kofe-indoneziya-sumatra-kerinchi-gr-1/
Кофе Колумбия Боливар от DOBRO COFFEE MICROROASTERS,https://specialty.ru/coffee/kofe-kolumbiya-bolivar/
Кофе Руанда Ньямашеке от DOBRO COFFEE MICROROASTERS,https://specialty.ru/coffee/kofe-ruanda-nyamasheke_2/
Дрип-пакеты Подарочный набор 1,https://specialty.ru/coffee/drip-pakety-podarochnyy-nabor-1/
Кофе Китай Юньнани от August Coffee,https://specialty.ru/coffee/kofe-kitay-yunnani_2/
Кофе Бразилия Минас-Жерайс от August Coffee,https://specialty.ru/coffee/kofe-braziliya-minas-zherays_5/
Кофе Индонезия Ява от August Coffee,https://specialty.ru/coffee/kofe-indoneziya-yava/
Кофе Индонезия Ачех от August Coffee,https://specialty.ru/coffee/kofe-indoneziya-achekh_1/
Подарочный набор с кофе Rise Джентельмена,https://specialty.ru/coffee/podarochnyy-nabor-s-kofe-rise-k-23-fevralya_1/
Кофе Кения Ньери от August Coffee,https://specialty.ru/coffee/kofe-keniya-neri_7/
Кофе Колумбия Белен де Умбриа Буэнависта от Macondo,https://specialty.ru/coffee/kofe-kolumbiya-belen-de-umbria-buenavista/
Кофе Колумбия Толима Гуава Банана от Macondo,https://specialty.ru/coffee/kofe-kolumbiya-tolima-el-vergel_4/
Кофе Колумбия Толима Эль Вергель от Macondo,https://specialty.ru/coffee/kofe-kolumbiya-tolima-el-vergel_5/
Кофе Гватемала Чимальтенанго от БОТАНИКА COFFEE ROASTERY,https://specialty.ru/coffee/kofe-gvatemala-chimaltenango/
Кофе Микс 2 от БОТАНИКА COFFEE ROASTERY,https://specialty.ru/coffee/kofe-miks-2_5/
Кофе Эфиопия Сидамо от БОТАНИКА COFFEE ROASTERY,https://specialty.ru/coffee/kofe-efiopiya-sidamo_14/
Кофе Колумбия Рисаральда от БОТАНИКА COFFEE ROASTERY,https://specialty.ru/coffee/kofe-kolumbiya-risaralda_5/
Кофе Бурунди Муйинга от СОВА,https://specialty.ru/coffee/kofe-burundi-muyinga_2/
Кофе Эфиопия Народы Юга Банко Готити от СОВА,https://specialty.ru/coffee/kofe-efiopiya-narody-yuga-banko-gotiti_2/
Кофе Колумбия Уила Сан-Агустин от СОВА,https://specialty.ru/coffee/kofe-kolumbiya-uila-san-agustin_1/
Кофе Колумбия Толима Планадас от СОВА,https://specialty.ru/coffee/kofe-kolumbiya-tolima-planadas/
Кофе Эфиопия Народы Юга Банко Готити от СОВА,https://specialty.ru/coffee/kofe-efiopiya-narody-yuga-banko-gotiti_3/
Кофе Бразилия Суль-де-Минас от SUBMARINE,https://specialty.ru/coffee/kofe-braziliya-sul-de-minas_5/
Кофе Колумбия Уила от SUBMARINE,https://specialty.ru/coffee/kofe-kolumbiya-uila_14/
Кофе Гондурас Санта Роза от БОТАНИКА COFFEE ROASTERY,https://specialty.ru/coffee/kofe-gonduras-santa-roza/
Кофе Колумбия Толима Эль Вергель от Macondo,https://specialty.ru/coffee/kofe-kolumbiya-tolima-el-vergel_6/
Кофе Колумбия Толима Фресно от Macondo,https://specialty.ru/coffee/kofe-kolumbiya-tolima-fresno/
Кофе Бразилия Сан-Жуан от БОТАНИКА COFFEE ROASTERY,https://specialty.ru/coffee/kofe-braziliya-san-zhuan/
Кофе Индонезия Западная Ява Фринса Эстате от SUBMARINE,https://specialty.ru/coffee/kofe-indoneziya-zapadnaya-yava-frinsa-estate_2/
Кофе Колумбия Уила Финка Маракай от SUBMARINE,https://specialty.ru/coffee/kofe-kolumbiya-uila-finka-marakay/
"Кофе Эфиопия Нэнсебо Западный Арси Ардент от РЫЖИЙ, МОРЕ И ЛОБОТРЯСЫ",https://specialty.ru/coffee/kofe-efiopiya-nensebo-zapadnyy-arsi-ardent/
"Кофе Руанда Южная провинция от РЫЖИЙ, МОРЕ И ЛОБОТРЯСЫ",https://specialty.ru/coffee/kofe-ruanda-yuzhnaya-provintsiya/
"Кофе Бразилия Капарао Ситио Шападинья от РЫЖИЙ, МОРЕ И ЛОБОТРЯСЫ",https://specialty.ru/coffee/kofe-braziliya-kaparao-sitio-shapadinya/
Кофе Бразилия Декаф от Хороший Тигр,https://specialty.ru/coffee/kofe-braziliya-dekaf_1/
Кофе Перу Эхарт от Хороший Тигр,https://specialty.ru/coffee/kofe-peru-ekhart/
Кофе Эфиопия Гуджи Шамола Гр. 2 от BolsheCoffee Roasters,https://specialty.ru/coffee/kofe-ethiopia-guji-chamola-gr-2/
Подарочный набор с кофе Rise для Богинь,https://specialty.ru/coffee/podarochnyy-nabor-s-kofe-rise-k-8-marta/
Кофе Бразилия Серрадо Минейро от DOBRO COFFEE MICROROASTERS,https://specialty.ru/coffee/kofe-braziliya-serrado-mineyro_8/
Кофе Китай Юньнани от DOBRO COFFEE MICROROASTERS,https://specialty.ru/coffee/kofe-kitay-yunnani_1/
Кофе Колумбия Рисаральда от DOBRO COFFEE MICROROASTERS,https://specialty.ru/coffee/kofe-kolumbiya-risaralda_4/
Кофе Уганда Касесе от DOBRO COFFEE MICROROASTERS,https://specialty.ru/coffee/kofe-uganda-kasese/
Кофе Эфиопия Сидамо от DOBRO COFFEE MICROROASTERS,https://specialty.ru/coffee/kofe-efiopiya-sidamo_10/
Кофе Гватемала Антигуа от DOBRO COFFEE MICROROASTERS,https://specialty.ru/coffee/kofe-gvatemala-antigua_1/
Кофе Гондурас Комаягуа от DOBRO COFFEE MICROROASTERS,https://specialty.ru/coffee/kofe-gonduras-komayagua_1/
Кофе Коста Рика Таррасу от DOBRO COFFEE MICROROASTERS,https://specialty.ru/coffee/kofe-kosta-rika-tarrasu_6/
Кофе Мексика Веракрус от DOBRO COFFEE MICROROASTERS,https://specialty.ru/coffee/kofe-meksika-verakrus/
Кофе Эфиопия Гуджи от DOBRO COFFEE MICROROASTERS,https://specialty.ru/coffee/kofe-efiopiya-gudzhi_6/
Колумбия Сан Агустин Эль Осо от ,https://specialty.ru/coffee/kolumbiya-san-agustin-el-oso/
Кофе Гватемала Антигуа от Kanga Roasters,https://specialty.ru/coffee/kofe-gvatemala-antigua_2/
"Набор с чашками Rise Glass Cup, Френч-прессом RISE Double wall 600 мл кофе в банке Rise Ethiopia",https://specialty.ru/coffee/nabor-s-chashkami-rise-glass-cup-french-pressom-rise-double-wall-600-ml-kofe-v-banke-rise-ethiopia/
"Набор с кофеваркой Varia Multi Brewer, кофе в банке Rise Colombia и бумажными фильтрами",https://specialty.ru/coffee/nabor-s-kofevarkoy-varia-multi-brewer-kofe-v-banke-rise-colombia-i-bumazhnymi-filtrami/
Набор из кобальтово-синих кофеных пар Rise Base 210 мл. и кофе в банках Rise,https://specialty.ru/coffee/nabor-iz-kobaltovo-sinikh-kofenykh-par-rise-base-210-ml-i-kofe-v-bankakh-rise/
Кофе Микс 2 от Yankee Sierra,https://specialty.ru/coffee/kofe-miks-2_3/
"Кофе Бразилия Эспирито Санто от РЫЖИЙ, МОРЕ И ЛОБОТРЯСЫ",https://specialty.ru/coffee/kofe-braziliya-espirito-santo/
"Кофе Колумбия Уила Лос Ногалес от РЫЖИЙ, МОРЕ И ЛОБОТРЯСЫ",https://specialty.ru/coffee/kofe-kolumbiya-uila-los-nogales/
"Кофе Колумбия Кундинамарка от РЫЖИЙ, МОРЕ И ЛОБОТРЯСЫ",https://specialty.ru/coffee/kofe-kolumbiya-kundinamarka/
"Кофе Эфиопия Оромия Буку от РЫЖИЙ, МОРЕ И ЛОБОТРЯСЫ",https://specialty.ru/coffee/kofe-efiopiya-oromiya-buku/
Кофе Бразилия Минас-Жерайс Да Лагоа от CAMERA OBSCURA,https://specialty.ru/coffee/kofe-braziliya-minas-zherays-da-lagoa/
Кофе Колумбия Декаф от CAMERA OBSCURA,https://specialty.ru/coffee/kofe-kolumbiya-dekaf/
Кофе Эфиопия Оромия от ,https://specialty.ru/coffee/kofe-efiopiya-oromiya/
Кофе Кения Центральное Высокогорье от Neva Coffee Roasters,https://specialty.ru/coffee/kofe-keniya-tsentralnoe-vysokogore_1/
Кофе Колумбия Кальдас от CAMERA OBSCURA,https://specialty.ru/coffee/kofe-kolumbiya-kaldas_1/
Кофе Уганда Зесуи Натуральная от BolsheCoffee Roasters,https://specialty.ru/coffee/kofe-uganda-zesui-naturalnaya/
Капсулы Кения Киамбу,https://specialty.ru/coffee/kapsuly-keniya-kiambu/
Кофе Эфиопия Сидамо Гр. 2 от БОТАНИКА COFFEE ROASTERY,https://specialty.ru/coffee/kofe-efiopiya-sidamo-gr-2/
Кофе Кения Мурарандия Гатуя от BolsheCoffee Roasters,https://specialty.ru/coffee/kofe-keniya-murarandiya-gatuya/
Кофе Бразилия Карму-ди-Минас от СОВА,https://specialty.ru/coffee/kofe-braziliya-karmu-di-minas_2/
Капсулы Nespresso Танзания Мбея,https://specialty.ru/coffee/kapsuly-nespresso-tanzaniya-mbeya/
Капсулы Nespresso Эфиопия Сидамо,https://specialty.ru/coffee/kapsuly-nespresso-efiopiya-sidamo/
Дрип-пакеты Микс 1,https://specialty.ru/coffee/drip-pakety-miks-1_5/
Кофе Эфиопия Сидамо от CAMERA OBSCURA,https://specialty.ru/coffee/kofe-efiopiya-sidamo_8/
Кофе Эфиопия Гедеб от Tasty Coffee,https://specialty.ru/coffee/kofe-efiopiya-gedeb/
Дрип-пакеты Руанда Ньямашеке,https://specialty.ru/coffee/drip-pakety-ruanda-nyamasheke/
Кофе Кения Рифт-Валли от СОВА,https://specialty.ru/coffee/kofe-keniya-rift-valli/
Кофе Микс Азия от СОВА,https://specialty.ru/coffee/kofe-miks-2/
"Кофе ""Супербленд из Америки"" от СОВА",https://specialty.ru/coffee/kofe-miks-2_1/
Кофе Микс Африка от СОВА,https://specialty.ru/coffee/kofe-miks-2_2/
Кофе Колумбия Белен де Умбриа Ла Дельфита от Macondo,https://specialty.ru/coffee/kofe-kolumbiya-belen-de-umbria-la-delfita/
Кофе Колумбия Кальдас от Macondo,https://specialty.ru/coffee/kofe-kolumbiya-kaldas_2/
Кофе Гондурас Комаягуа от ,https://specialty.ru/coffee/kofe-gonduras-komayagua/
Кофе Кения Нарок от ,https://specialty.ru/coffee/kofe-keniya-narok/
Кофе Гондурас Маркала от ,https://specialty.ru/coffee/kofe-gonduras-markala/
Кофе Китай Сымао от ,https://specialty.ru/coffee/kofe-kitay-symao/
Кофе Сальвадор Ауачапан от ,https://specialty.ru/coffee/kofe-salvador-auachapan/
Дрип-пакеты Колумбия Белен де Умбриа Ла Дельфита,https://specialty.ru/coffee/drip-pakety-kolumbiya-belen-de-umbria-la-delfita/
"Набор с кофе Rise, кофемолкой Varia и воронкой голубой Kalita",https://specialty.ru/coffee/nabor-s-kofe-rise-kofemolkoy-varia-i-voronkoy-goluboy-kalita/
Набор с дрип пакетами Rise и розовой чашкой Rise Sun,https://specialty.ru/coffee/nabor-s-drip-paketami-rise-i-rozovoy-chashkoy-rise-sun/
набор с дрип пакетами Rise Brazil и заварочным чайником Rise,https://specialty.ru/coffee/nabor-s-drip-paketami-rise-brazil-i-zavarochnym-chaynikom-rise/
"Набор с чашками Rise Glass Cup, Френч-прессом RISE Double wall 600 мл кофе в банке Rise Colombia",https://specialty.ru/coffee/nabor-s-chashkami-rise-glass-cup-french-pressom-rise-double-wall-600-ml-kofe-v-banke-rise-colombia/
Кофе Гондурас Маркала от Yankee Sierra,https://specialty.ru/coffee/kofe-gonduras-markala_1/
Кофе Бразилия Серрадо Минейро от Yankee Sierra,https://specialty.ru/coffee/kofe-braziliya-serrado-mineyro_5/
Кофе Колумбия Толима Эль Эден от Yankee Sierra,https://specialty.ru/coffee/kofe-kolumbiya-tolima-el-eden_1/
Кофе Эфиопия Гедеб от Yankee Sierra,https://specialty.ru/coffee/kofe-efiopiya-gedeb_1/
Кофе Танзания Мбея от Yankee Sierra,https://specialty.ru/coffee/kofe-tanzaniya-mbeya_2/
Кофе Кения Ньери от Yankee Sierra,https://specialty.ru/coffee/kofe-keniya-neri_6/
Дрип-пакеты Эфиопия Гуджи,https://specialty.ru/coffee/drip-pakety-efiopiya-gudzhi/
Капуслы Индонезия Ява,https://specialty.ru/coffee/kapusly-indoneziya-yava/
Капуслы Колумбия Уила,https://specialty.ru/coffee/kapusly-kolumbiya-uila/
Дрип-пакеты Микс 1,https://specialty.ru/coffee/drip-pakety-miks-1_7/
Кофе Кения Кириньяга Мара от August Coffee,https://specialty.ru/coffee/kofe-keniya-kirinyaga_4/
Кофе Колумбия Уила АА от БОТАНИКА COFFEE ROASTERY,https://specialty.ru/coffee/kofe-kolumbiya-uila-aa/
Кофе Колумбия Толима от Toggle Coffee,https://specialty.ru/coffee/kofe-kolumbiya-tolima_1/
Кофе Перу Кахамарка Альтос Пираис от Toggle Coffee,https://specialty.ru/coffee/kofe-peru-kakhamarka-altos-pirais/
Дрип-пакеты Кения Кириньяга,https://specialty.ru/coffee/drip-pakety-keniya-kirinyaga/
Кофе Кения Кириньяга Гитумби от SUBMARINE,https://specialty.ru/coffee/kofe-keniya-kirinyaga-gitumbi/
Кофе Колумбия Рисаральда Ла Дельфита от MIKALE,https://specialty.ru/coffee/kofe-kolumbiya-risaralda-la-delfita/
Кофе Бразилия Моджиана от ,https://specialty.ru/coffee/kofe-braziliya-modzhiana_2/
Кофе Колумбия Киндио Блоссом от Kanga Roasters,https://specialty.ru/coffee/kofe-kolumbiya-kindio-blossom/
Кофе Кения Кириньяга Масаи от BolsheCoffee Roasters,https://specialty.ru/coffee/keniya-kirinyaga-masai/
Кофе Уганда Элгон Мытая от BolsheCoffee Roasters,https://specialty.ru/coffee/uganda-elgon/
Кофе Эфиопия Йиргачефф от SUBMARINE,https://specialty.ru/coffee/kofe-efiopiya-yirgacheff_4/
Кофе Бразилия Суль-де-Минас от SUBMARINE,https://specialty.ru/coffee/kofe-braziliya-sul-de-minas_2/
Кофе Бразилия Суль-де-Минас Лагонья от ,https://specialty.ru/coffee/kofe-braziliya-sul-de-minas-lagonya_1/
Капсулы Nespresso Колумбия Киндио,https://specialty.ru/coffee/kapsuly-nespresso-kolumbiya-kindio/
Кофе Колумбия Уила от MOST COFFEE ROASTERS,https://specialty.ru/coffee/kofe-kolumbiya-uila_5/
Кофе Бразилия Моджиана от MOST COFFEE ROASTERS,https://specialty.ru/coffee/kofe-braziliya-modzhiana_3/
Кофе Бразилия Серрадо Минейро от MOST COFFEE ROASTERS,https://specialty.ru/coffee/kofe-braziliya-serrado-mineyro_3/
Кофе Бразилия Серра-да-Мантикейра от August Coffee,https://specialty.ru/coffee/kofe-braziliya-serra-da-mantikeyra/
Кофе Колумбия Уила Ла Вирджиния от August Coffee,https://specialty.ru/coffee/kofe-kolumbiya-uila-la-virdzhiniya_1/
Кофе Гватемала Уэуэтенанго от August Coffee,https://specialty.ru/coffee/kofe-gvatemala-ueuetenango_1/
Кофе Руанда Хуэй от August Coffee,https://specialty.ru/coffee/kofe-ruanda-khuey/
Кофе Эфиопия Сидамо от Yankee Sierra,https://specialty.ru/coffee/kofe-efiopiya-sidamo_7/
Кофе Гватемала Санта Роза Аярза от Yankee Sierra,https://specialty.ru/coffee/kofe-gvatemala-santa-roza-ayarza/
Кофе Колумбия Уила Аромас дель Сур от Yankee Sierra,https://specialty.ru/coffee/kofe-kolumbiya-uila-aromas-del-sur_1/
Кофе Индонезия 1 Фринса Коллектив от Yankee Sierra,https://specialty.ru/coffee/kofe-indoneziya-1-frinsa-kollektiv/
Кофе Перу Инка от August Coffee,https://specialty.ru/coffee/kofe-peru-1/
Кофе Китай Пуэр от BolsheCoffee Roasters,https://specialty.ru/coffee/kofe-kitay-puer/
Кофе Руанда 1 от Kanga Roasters,https://specialty.ru/coffee/kofe-ruanda-1/
Кофе Индонезия 1 от Kanga Roasters,https://specialty.ru/coffee/kofe-indoneziya-1/
Кофе Кения Кириньяга от Kanga Roasters,https://specialty.ru/coffee/kofe-keniya-kirinyaga_2/
Кофе Уганда Рувензори от CAMERA OBSCURA,https://specialty.ru/coffee/kofe-uganda-ruvenzori/
