name,url
Кофе Бразилия Посус ди Калдас Порта ду Сеу от CAMERA OBSCURA,https://specialty.ru/coffee/kofe-braziliya-posus-di-kaldas-porta-du-seu/
Кофе Колумбия Уила от MIKALE,https://specialty.ru/coffee/kofe-kolumbiya-uila_6/
Дрип-пакеты Индонезия Ява Фринса Коллектив,https://specialty.ru/coffee/drip-pakety-indoneziya-yava-frinsa-kollektiv/
Кофе Вьетнам Шонла от DOBRO COFFEE MICROROASTERS,https://specialty.ru/coffee/kofe-vetnam-shonla/
Кофе Гватемала Уэуэтенанго Ла Гардения от DOBRO COFFEE MICROROASTERS,https://specialty.ru/coffee/kofe-gvatemala-ueuetenango-la-gardeniya/
Кофе Руанда Ньямашеке от DOBRO COFFEE MICROROASTERS,https://specialty.ru/coffee/kofe-ruanda-nyamasheke/
Кофе Уганда Мбале от DOBRO COFFEE MICROROASTERS,https://specialty.ru/coffee/kofe-uganda-mbale/
Кофе Уганда Элгон от DOBRO COFFEE MICROROASTERS,https://specialty.ru/coffee/kofe-uganda-elgon/
Кофе Эфиопия Гуджи от DOBRO COFFEE MICROROASTERS,https://specialty.ru/coffee/kofe-efiopiya-gudzhi_2/
Кофе Бразилия Серрадо Минейро от DOBRO COFFEE MICROROASTERS,https://specialty.ru/coffee/kofe-braziliya-serrado-mineyro_4/
Кофе Гватемала Капетилло от SUBMARINE,https://specialty.ru/coffee/kofe-gvatemala-kapetillo/
Дрип-пакеты Эфиопия Сидамо,https://specialty.ru/coffee/drip-pakety-efiopiya-sidamo_3/
Кофе Кения Ньери Кагури от MOST COFFEE ROASTERS,https://specialty.ru/coffee/kofe-keniya-neri-kaguri/
Дрип-пакеты Гватемала Декаф,https://specialty.ru/coffee/drip-pakety-gvatemala-dekaf/
Кофе Эфиопия Йиргачефф от August Coffee,https://specialty.ru/coffee/kofe-efiopiya-yirgacheff_3/
Кофе Эфиопия Сидамо от August Coffee,https://specialty.ru/coffee/kofe-efiopiya-sidamo_4/
Дрип-пакеты Сальвадор Апанека Финка Атзумпа,https://specialty.ru/coffee/drip-pakety-el-salvador-salvador/
Дрип-пакеты Гватемала Уэуэтенанго,https://specialty.ru/coffee/drip-pakety-gvatemala-ueuetenango/
Дрип-пакеты Индонезия Суматра,https://specialty.ru/coffee/drip-pakety-indoneziya-sumatra/
Дрип-пакеты Руанда Мутетели,https://specialty.ru/coffee/drip-pakety-ruanda-muteteli/
Капсулы Колумбия Уила,https://specialty.ru/coffee/kapsuly-kolumbiya-uila/
Капсулы Индонезия Суматра,https://specialty.ru/coffee/kapsuly-indoneziya-sumatra/
Капсулы Rise Brazil,https://specialty.ru/coffee/kapsuly-rise-brazil/
Капсулы Rise Colombia,https://specialty.ru/coffee/kapsuly-rise-colombia/
Капсулы Rise Ethiopia,https://specialty.ru/coffee/kapsuly-rise-ethiopia/
Дрип-пакеты Rise Brazil,https://specialty.ru/coffee/drip-pakety-rise-brazil/
Дрип-пакеты Rise Colombia,https://specialty.ru/coffee/drip-pakety-rise-colombia/
Дрип-пакеты Rise Ethiopia,https://specialty.ru/coffee/drip-pakety-rise-ethiopia/
Капсулы Irish Cream 1,https://specialty.ru/coffee/kapsuly-irish-cream-1/
Капсулы Strong 1,https://specialty.ru/coffee/kapsuly-classic-1/
Кофе Коста Рика Таррасу SHB от The Coffee Soldiers,https://specialty.ru/coffee/kofe_costa_rica_tarrazu_shb_1/
Кофе Эфиопия Нэнсебо Западный Арси от The Coffee Soldiers,https://specialty.ru/coffee/kofe_ethiopia_nensebo_west_arsi/
Кофе Бразилия Серрадо Минейро Альта Моджиана SHG от Tedjas Coffee Beans,https://specialty.ru/coffee/kofe-brazil-cerrado-mineiro-alta-mogiana-shg/
Кофе Бразилия Суль-де-Минас от Neva Coffee Roasters,https://specialty.ru/coffee/kofe_brazil_sul_du_minas_1/
Кофе Эфиопия Гуджи Гр. 2 от Neva Coffee Roasters,https://specialty.ru/coffee/kofe_ethiopia_guji_gr_2_3/
Кофе Перу Чанчамайо от Neva Coffee Roasters,https://specialty.ru/coffee/kofe_peru_chanchamayo/
Кофе Танзания Килиманджаро SHB от Neva Coffee Roasters,https://specialty.ru/coffee/kofe_tanzania_kilimanjaro_shb/
Кофе Эфиопия Гуджи от Just Coffee,https://specialty.ru/coffee/kofe_ethiopia_guji_2/
Кофе Гондурас Копан от Just Coffee,https://specialty.ru/coffee/kofe_gonduras_copan_1/
Кофе Эфиопия Оромия от Just Coffee,https://specialty.ru/coffee/kofe_ethiopia_oromia/
Кофе Колумбия Уила Супремо от Just Coffee,https://specialty.ru/coffee/kofe_colombia_huila_supremo_2/
Кофе Колумбия Киндио от The Coffee Soldiers,https://specialty.ru/coffee/kofe_colombia_quindio_1/
Дрип-пакеты Эфиопия Область Народностей Южной Эфиопии,https://specialty.ru/coffee/drip-pakety-ethiopia-southern-nations_1/
Кофе Бразилия Минас-Жерайс от Rockets Coffee Roasters,https://specialty.ru/coffee/kofe-brazil-minas-gerais/
Кофе Индия Карнатака от Just Coffee,https://specialty.ru/coffee/kofe-indiya-karnataka/
Кофе Колумбия Уила Excelso от BolsheCoffee Roasters,https://specialty.ru/coffee/kolumbiya-uila-excelso/
Кофе Кения Ньери АВ от Kanga Roasters,https://specialty.ru/coffee/kofe-keniya-neri-av/
Кофе Руанда Мутетели от Kanga Roasters,https://specialty.ru/coffee/kofe-ruanda-muteteli/
Кофе Эфиопия Гуджи Гр. 1 от Kanga Roasters,https://specialty.ru/coffee/kofe-efiopiya-gudzhi-gr-1/
Кофе Эфиопия Нэнсебо Западный Арси от Kanga Roasters,https://specialty.ru/coffee/kofe-efiopiya-nensebo-zapadnyy-arsi/
Кофе Эфиопия Гуджи Кочере от Kanga Roasters,https://specialty.ru/coffee/kofe-efiopiya-gudzhi-gr-2/
Кофе Эфиопия Йиргачефф Гр. 4 от Tasty Coffee,https://specialty.ru/coffee/kofe-efiopiya-yirgacheff-gr-4/
Кофе Бразилия Моджиана от Tasty Coffee,https://specialty.ru/coffee/kofe-braziliya-modzhiana/
Кофе Бразилия Серрадо Минейро от Tasty Coffee,https://specialty.ru/coffee/kofe-braziliya-serrado-mineyro/
Кофе Колумбия Уила от Tasty Coffee,https://specialty.ru/coffee/kofe-kolumbiya-uila_1/
Кофе Коста Рика Таррасу от Tasty Coffee,https://specialty.ru/coffee/kofe-kosta-rika-tarrasu/
Кофе Кения Центральное Высокогорье от Tasty Coffee,https://specialty.ru/coffee/kofe-keniya-tsentralnoe-vysokogore/
Кофе Колумбия Уила от Tasty Coffee,https://specialty.ru/coffee/kofe-kolumbiya-uila_2/
Кофе Эфиопия Сидамо от Tasty Coffee,https://specialty.ru/coffee/kofe-efiopiya-sidamo/
Кофе Гватемала Санта Роза от Tasty Coffee,https://specialty.ru/coffee/kofe-gvatemala-santa-roza/
Кофе Бразилия Минас-Жерайс от ROMKIN’S,https://specialty.ru/coffee/kofe-braziliya-minas-zherays/
Кофе Колумбия Каука от ,https://specialty.ru/coffee/kofe-kolumbiya-kauka_1/
Кофе Конго Киву от August Coffee,https://specialty.ru/coffee/kofe-kongo-kivu/
Кофе Перу Чанчамайо от Rockets Coffee Roasters,https://specialty.ru/coffee/kofe-peru-chanchamayo/
Кофе Колумбия Уила от МАМА ВАРИТ КОФЕ ,https://specialty.ru/coffee/kofe-kolumbiya-uila_3/
Кофе Эфиопия Йиргачефф от Brew Me,https://specialty.ru/coffee/kofe-efiopiya-yirgacheff_2/
Капсулы Горячий шоколад 1,https://specialty.ru/coffee/kapsuly-goryachiy-shokolad-1/
Капсулы Vanilla 1,https://specialty.ru/coffee/kapsuly-vanilla-1/
Капсулы Delicate 1,https://specialty.ru/coffee/kapsuly-dekaf-1/
Дрип-пакеты Перу Кахамарка,https://specialty.ru/coffee/drip-pakety-peru-kakhamarka/
Дрип-пакеты Бразилия Суль-де-Минас,https://specialty.ru/coffee/drip-pakety-braziliya-sul-de-minas/
Капсулы Nespresso Декаф,https://specialty.ru/coffee/kapsuly-dekaf-1_1/
Капсулы Nespresso Classic,https://specialty.ru/coffee/kapsuly-classic/
Кофе Индонезия Ява Фринса от MIKALE,https://specialty.ru/coffee/kofe-indoneziya-yava-frinsa-edun/
Кофе Колумбия Уила Ла Илюзьон от Tedjas Coffee Beans,https://specialty.ru/coffee/kofe-kolumbiya-uila-la-ilyuzon/
Кофе Колумбия Уила SHB от Tedjas Coffee Beans,https://specialty.ru/coffee/kofe-kolumbiya-uila-shb/
Кофе Коста Рика Таррасу SHG от Tedjas Coffee Beans,https://specialty.ru/coffee/kofe-kosta-rika-tarrasu-shg/
Кофе Гватемала Уэуэтенанго Лас Амаполас от BolsheCoffee Roasters,https://specialty.ru/coffee/gvatemala-ueuetenango-las-amapolas/
Кофе Бразилия Карму-ди-Минас Мантикейра от BolsheCoffee Roasters,https://specialty.ru/coffee/braziliya-karmu-di-minas-mantikeyra/
"Подарочный набор кофе в зёрнах RISE, 3 банки от ",https://specialty.ru/coffee/nabor-kofe-v-zyernakh-3-banki-rise-brazil-colombia-ethiopia/
Кофе Эфиопия Буку от August Coffee,https://specialty.ru/coffee/kofe-efiopiya-buku/
Кофе Бразилия Серрадо Минейро от August Coffee,https://specialty.ru/coffee/kofe-braziliya-serrado-mineyro_2/
Кофе Бразилия Серрадо Минейро Expocaccer от The Coffee Soldiers,https://specialty.ru/coffee/kofe_brazil_cerrado_mineiro_expocaccer_3/
Кофе Бразилия Минас-Жерайс Фазенда Ранчария от SUBMARINE,https://specialty.ru/coffee/kofe-braziliya-minas-zherays-fazenda-ranchariya/
Кофе Колумбия Уила Табиленд от SUBMARINE,https://specialty.ru/coffee/kofe-kolumbiya-uila-tabilend/
Кофе Колумбия Антьокия Вилла Клабелина от SUBMARINE,https://specialty.ru/coffee/kofe-kolumbiya-antokiya-villa-klabelina/
Кофе Перу Хаен Эль Барженон от SUBMARINE,https://specialty.ru/coffee/kofe-peru-khaen-el-barzhenon/
