comment,rating,username
"То что надо под пивас и чипсы Отзыв ""быдло"" на онлайн кинотеатр Netflix: Коротко и без фильтров! Ну что, друзья, я тут решил поделиться своим откровенным отзывом о онлайн кинотеатре Netflix. Приготовьтесь, будет правдиво и без цветных очков! Сначала о плюсах: -...  Разнообразие фильмов и сериалов,доступность  Цена",4,Vadim2282
"Если вы киноман, то это точно для вас Ох, дорогой мой киноман, Netflix - это настоящая волшебная палочка развлечений! Если у тебя есть желание погрузиться в захватывающие истории, преодолеть смешные приключения или просто окунуться в мир качественного контента, то Netflix - это именно...  Неограниченное количество фильмов и сериалов!  Пока что нету ",5,Витя3ь
"удобно и доступен в любом месте Netflix - это исключительный онлайн-кинотеатр, который устанавливает золотой стандарт для потоковых сервисов. Обладая обширной и постоянно растущей библиотекой фильмов, телесериалов и оригинального контента, Netflix удовлетворяет широкий спектр вкусов и интересов. Его удобный интерфейс упрощает изучение...  Много контента, оригинального контента  у некоторых картинках нет перевода, цена",5,TiredFROG
"Лучший ""NETFLIX"" - это лучшая моя находка за все время. Никогда не был фанатом фильмов, сериалов или мультфильмов, но благодаря данному онлайн-кинотеатру открыл для себя новый мир, который невозможно покорить. Теперь и днем и ночью, да...  Эта находна и есть один сплошной плюс  Их просто-напросто неь",5,HikitaSHxArm
"Довольна Я часто выбираю новинки именно на Netflix, так как здесь всегда есть актуальные фильмы и сериалы. Здесь представлено огромное количество контента, включая русские профессиональные переводы. Качество картинки и звука на Netflix просто шикарное. Я всегда...  Четкий звук; постоянно появляются новинки сериалов и фильмов  Привязка карты; цена подписки",4,Maria022
"Удобный сервис для просмотра фильмов и сериалов, с большим выбором контента. Netflix - это один из лучших онлайн-кинотеатров, которые я когда-либо использовал. Он предлагает большое количество фильмов и сериалов, доступных для потоковой передачи, и обновляет свою библиотеку регулярно. Возможность смотреть фильмы и сериалы на любом устройстве...  Плюсы: Большой выбор контента, оригинальные фильмы и сериалы, удобный интерфейс, персонализированные рекомендации.  Минусы: Высокая цена подписки, ограничения на одновременное использование аккаунта, некоторые фильмы и сериалы могут быть удалены.",5,Shakhzod007
"Отличный сайт. Плюсы использования сервиса Netflix: 1. Широкий выбор контента: Netflix предлагает большой ассортимент кино и сериалов, в том числе собственного производства, что позволяет выбрать нужное именно для вас. 2. Комфортный просмотр: Вы можете смотреть любимые фильмы...  Много хороших и эксклюзивных сериалов.  Цена подписки.",5,ustyigor260606
"Лучший сайт для фильмов! Изумительная платформа для потоковой передачи фильмов и сериалов! Netflix предлагает огромный выбор контента для всех возрастных групп и вкусов. Я наслаждаюсь просмотром фильмов и сериалов на Netflix каждый день. Качество видео является одним из лучших...  Почти все фильмы в высоком качестве, а умные алгоритмы подберут фильм для вас!  Не дешевая подписка!",5,Asonss
"Шикарный онлайн кинотеатр Всем приветик ))) Я и мой муж обожаем Netflix, это шикарная площадка для просмотра фильмов !!! Самое главное так как снимает Netflix не снимает никто …это превосходно !!! Все фильмы с Netflix крутые и мы...  Все превосходно , обожаю Netflix   Нет ",5,NataliMad
"Осталась очень довольна Отличное приложение для просмотра фильмов (сериалов) но не всегда есть русская озвучка отлично подойдёт тем кто учит английский по сериалам, еще можно сохранять видео что тоже очень удобно особенно когда ты в дороге и у...  Удобно   Дорого, мало русской озвучки",5,Katerinka17ye
"Спасение от скуки по вечерам Огромный поток выбора начиная от сериалов и фильмов заканчивая мультфильмами разных годов. С подпиской открывается ещё больше возможностей. Приятный интерфейс и легкодоступность, найти можно абсолютно всё. Дорамы, фильмы и сериалы разных стран, мультсериалы которые вышли...  Хорошее качество и большой выбор.  Отсутствуют",5,samurai-sama
"Положительное, много контента Netflix - это отличный онлайн-кинотеатр для любителей кино и сериалов. Сайт предлагает огромный выбор контента различных жанров и форматов, включая оригинальные фильмы и сериалы Netflix. Качество видео и звука на высшем уровне, а возможность смотреть...  Разнообразие ( как по женрам, так и странам)  Цена немного завышена",5,ИринаКарташова
"Очень годный онлайн-кинотеатр Мне нравится Netflix за его удобство и качество контента. Сервис довольно прост в использовании, он зависит от вашего интернет-соединения, и вы можете смотреть фильмы в любое время и в любом месте. В Netflix есть множество...  Удобный интерфейс наличие многих сериалов и фильмов  Отсутствие фильмов в некоторых регионах. ",5,Ilya91m
"Отличный выбор. Netflix - это отличный стриминговый сервис для тех, кто хочет смотреть фильмы и сериалы без рекламы. Удобный интерфейс позволяет легко находить интересующий контент и сохранять его для последующего просмотра. Библиотека фильмов и сериалов на Netflix...  Некоторые из преимуществ подписки на Netflix включают:    1. Большой выбор контента: Netflix предлагает огромный выбор фильмов,  : хотя Netflix предлагает обширный каталог фильмов и сериалов, все же не все    ",5,Shahina29
"Прекрасная идея для домашнего просмотра Домашний кинотеатр Netflix - это прекрасный способ окунуться в мир кино и сериалов, не выходя из дома. Я очень доволен качеством контента на платформе Netflix, а также удобством использования сервиса. С помощью домашнего кинотеатра Netflix...  Удобно и практично, с каждым разом все больше и больше интересный шедевров, и с каждым разом сюжет все интереснее и не менее захватывающий   Мне кажется как таковых минусов я не нашел, все предостаточно хорошо и легко в использовании, разве что платная подписка))",5,Daniarmaksatov8
"Всё удобно, очень простой интерфейс. В целом я ставлю 5звезд, потому что это самые любимые сериалы где я люблю больше всего смотреть, да и фильмы это что-то, для меня это самое отличное Netflix всё самое захватывающее смотрю там, ну и...  Много всяких новых новинок, да и смотреть можно на любых устройствах   Как по мне минусов я вообще не заметил, в не даже нет рекламы ",5,Carter1234
"Не пожалели, что оформили подписку) Мы с мужем заядлые сериаломаны и если вечер прошел без просмотра любимого сериала – это был плохой вечер. Ну любим мы понаблюдать за историями, в процессе обсудить героев и все это вместе с чем-нибудь вкусненьким...  Простота, автоматический переход между сериями, разнообразие  Мало русского контента",4,IvanovaSonia
"Netflix - лучший сервис с лучшими кино и сериалами Я хочу поделиться своим положительным опытом использования онлайн-кинотеатра Netflix. Я уже несколько лет являюсь его постоянным клиентом и могу сказать, что это один из лучших сервисов для просмотра фильмов и сериалов. Во-первых, удобный интерфейс и...  Удобный интерфейс, большой выбор лучших кино и сериалов  Не заметмл",5,nikkash
"одобрено Почти несколько лет пользуюсь ! оформила подписку и теперь в день по несколько сериалов фильмов смотрю Это очень удобно! Одни раз сделал и сколько добра СОВЕТУЮ ВСЕМ РЕБЯТА...  очень хорошое качество,много зарубежных фильмов   Не нашала",5,Alina -2
"Очень хорошо Я имею личный опыт просмотра фильмов и сериалов на Netflix, но могу сказать, что по отзывам пользователей это один из самых популярных и удобных сервисов стриминга контента на сегодняшний день. Он предлагает огромный выбор фильмов...  Хороший, удобный   Нету ",5,Haldi95
"Неплохой онлайн-кинотеатр Есть бесплатная подписка на фильмы, которой я пользуюсь и готов дальше покупать уже платную подписку. В целом, фильмы, аниме, сериалы снимают неплохие, но каждое творчество может быть для любителя, у каждого человека собственный вкус, поэтому...  Фильмы, сериалы, аниме с интересным сюжетом   Пропаганда ЛГБТ сообществ ",4,Чёрный клевер
"лучший онлайн-кинотеатр Я уже несколько лет пользуюсь сервисом Netflix и могу с уверенностью сказать, что он является одним из лучших онлайн-кинотеатров на сегодняшний день. Недавно я решил поделиться своими впечатлениями о нем. Первое, что бросается в глаза...  удобный интерфейс и качество  сложно сказать ведь разные фильмы нравятся разным людям",5,mokakoi
"Увлекательный контент Netflix - это удобная и широко популярная платформа для потокового просмотра фильмов и сериалов с высоким качеством контента и удобным интерфейсом. Она предлагает огромный выбор контента в различных жанрах и на разных языках, что делает...  Огромный выбор контента в различных жанрах и на разных языках,высокое качество контента и удобный интерфейс.  Ограничения на доступность некоторого контента в некоторых странах или регионах",4,Ice23zz
"Хороший онлайн-кинотеатр Плюсы: Огромное количество контента доступно для потокового вещания 1 в виде телешоу, фильмов и т. д. Netflix располагает обширной библиотекой, включая популярный оригинальный контент. Отсутствие рекламы в любом пакете подписки. Удобные функции 2, включая возможность...  Действительно много контента  Геолокация может препятствовать доступу к контенту",4,iMironcheg
"Большой выбор фильмов и сериалов бесплатно Приветствую всех, кто читает отзывы. В Netflix маленький выбор фильмов на русском. Многие фильмы даже не переведены на русский язык. Конечно, есть субтитры, но так не удобно смотреть, потому что хочется погрузиться в сюжет, а...  Можно смотреть, что хочешь в хорошем качестве   Мало хороших фильмов ",3,Lizaurtaeva
"Пользовался данной платформой давненько, и по периоду пользования - мне все нравилось, придираться не к чему. добрый день! Хочу поделиться своим мнением о Netflix. Пользовался данной платформой давненько, и по периоду пользования - мне все нравилось, придираться не к чему. Огромный выбор жанров. Отличное оформление, что меня всегда радует, так как...  Огромный выбор жанров. Отличное оформление.   огромный минус - цена",4,n1nfisss
"Любимый сервис Смотрю любимые сериалы на удобном сервисе ! Хорошие сериалы отличного качества на сервисе ! Самый лучший сервис для просмотров фильмов/сериалов...  Есть все,что нужно   Нет ",5,Svetlana1232133
"Качество отличное и много фильмов Недавно подключили пока все отлично. Много интересных фильмов. Удобный сайт. Хорошо работает, не зависает. Все же последнее время многие интересные фильмы работают совместно с Нетфликс, поэтому и...  Удобно.  Пока не вижу минусов ",5,Adilya99
"Сойдёт Здравствуйте дорогие читатели отзовик! Я часто смотрю сериалы, фильмы, мультфильмы, аниме, дорамы, документальные фильмы и прочее... и по мимо гугла, смотрела ещё и на Нетфликсе. Всё очень нравилось, да и сейчас нравится. Сериалы классные, никогда...  Разнообразие фильмов, сериалов, функции, и многое другое.   Иногда нет русской озвучки и на многих других языках (но есть субтитры).",4,Ялюблюлюдей
"Просто великолепный сервис для просмотра сериалов и фильмов различного жанра Netflix - это сайт с множеством сериалов и фильмов, который захватил весь мир. Благодаря огромной библиотеке как новых, так и классических фильмов и сериалов, неудивительно, что Netflix стал основным сервисом для всех, кто любит смотреть...  Разнообразие контента  Удобство в пользовании   Множество инструментов   Цена подписки( ",5,Roflman
"Неплохо но дорого Пользовался Netflix на игровой приставке playstation 4 была подписка на приставке пс + думаю на это не влияло бесплатный месяц на нетфликс. Я сам ничего не платил бесплатный месяц был но посмотрел сколько платить за...  Качество, хорошие сервисы, отличное приложение  Цена подписки за hd качество,большинство контента нет  русского перевода и субтитров русских",4,Def366
"Сайт отлиичный и качественный, но как приложение мне не понравилось. NETFLIX представляет собой платформу на котрой можно смотреть фильмы, сериалы и прочее. Сайт очень оптимистичный и в при его использовании можно открыть много чего нового и интересного. Отличное качество и звук, но бывает, что озвучка...  Отличное качество и работа сайта.  Приложение вылетает и порой может просто не слушаться нажатий.",5,Arteem566
"Лучший онлайн кинотеатр, с большим выбором Это наверное одно из самых лучших что придумало человечество, это идеальный онлайн кинотеатр, с огромным списком фильмов, сериалов, на любой вкус и цвет. Смотреть фильмы Netflix одно удовольствие, когда приезжаешь домой, покупаешь вкусную еду и...  Качество   Нету ",5,Vitalik1921
"Очень удобный, и крутой кинотеатр Нетфликс один из самых крутых кинотеатр такие интересные фильмы, все года с интересной тематикой и сценарием, не разумные видео плохого фильма на нетфликс, все самое лучше, очень рекомендую посмотреть сериалы от нетфликс как : избежать...  Очень крутые сериалы, фильмы, мультфильм, много очень интересных и захватывающие, очень глубоки и не утомительные.  Не знаю что написать напишу, АННА ЛИЗЗА КИТИНГ КРАШ)))",5,Dengallager1408
"Лучшие Самая лучшая платформа сериалов. Качество шедевральное. Смотрю все фильмы на немецком! Сейчас большенство нормальных фильмов снимает нетфликс и качество...  Быстро, классно  Дорого",5,19niagara91
Удобно Очень удобно Я был 400 часов на сайте и в приложении очень удобно. Я люблю смотреть фильмы. Люди могут смотреть как платно так и бесплатно а ещё есть такая вещь как промокод так сним это...  Удобно  Нету,4,Boom151
"Моя боль( Netflix - это моя любовь, ну почему его запретили в нашей стране((((( С карантина пользовалась этим кинотеатром, обожала до боли в сердце, я конечно не киноман, да и впх принципе могу использовать КиноПоиск, но есть...  Отличные  фильмы и сериалы с хорошим сюжетом  Запретили в России и теперь тяжело смотреть, приходится пытаться обходить эту систему дополнительной оплатой, через непроверенные сайты(",5,Lirikabixi
"Удобно, недорого Всех приветствую, дорогие и любимые пользователи и читатели интернет площадки, под названием ""Отзовик"". Всем на сегодняшний день, нравится смотреть различные фильмы и мультфильмы. Для этого создали разные приложения и площадки для этого, чтобы вы не...  Цена не дорогая, нет багов и лагов  Нет ",5,Garage Man
"Конкуренция,ради конкуренции Интересная петрушка получается. С одной стороны мы оформляем подписку, но с другой никто не защитит наши права, от отзыва головной компанией разрешения, на прокат, например в той же Россыыыи каких либо сериалов. Я сейчас, не...  Неплохая платформа, которая создает отличные сериалы...  Мы не защищены от произвола остаться без контента,в случае изменения политики компании",4,Ret45
