comment,rating,username
"офигенный онлайн кинотеатр Netflix -офигенный онлайн-кинотеатр. Широкий выбор фильмов и сериалов, оригинальные контенты, удобное воспроизведение. Отличное развлечение для всех возрастов. Сами фильмы тоже интересные. Удобный в использовании и сам...  Удобный в использовании   некоторые фильмы однотипные ( фильмы про подростков)",5,slonotop12
"Один из самых удобных онлайн-кинотеатров Я около полугода использовал Netflix в качестве своего основного онлайн-кинотеатра, и мой опыт использования был вполне положительным. Во-первых, мне очень нравится огромный каталог фильмов и сериалов, доступных на платформе. Netflix предлагает широкий выбор различных жанров...  Огромный выбор контента, удобство использования, высокое качество  Не обнаружил",5,Total Dark
"Нет повторных сюжетов Нетфликс впечатляет тем, что там нет сериалов с одинаковыми сюжетами, сто очень и радует. С каждым просмотром сериала или фильма, я наполняют эмоциями Особенно «Элита», «Бумажный...  Актеры   Нет ",5,Lerkaaaa
"Максимально комфортный сервис Я просто влюбилась в сервис Нетфликс! Я уже посмотрела большое количество фильмов и сериалов, такие как: будка поцелуев, Достать ножи, Очень странные дела, Уэнслей, Бумажный дом, Тайно Ко Ко, Игра в кальмара и так далее...  Качество фильмов на высоте, каждый фильм - новая вселенная  Минусов не заметила",5,Cherryisve
"Отличный сервис для просмотра фильмов и сериалов,пользуюсь им уже год. Сервис отлично подходит для просмотра фильмов и сериалов разных жанров. Начиная от драмы и заканчивая ужазасами и фэнтези. После каждого рабочего дня сажусь посмотреть новинки. Качество звука и картинки хорошее, перевод точный и приятный на...  из плюсов могу выделить то,что онлайн-кинотеатр очень удобен в пользовании,не нужно долго разбираться над его работой,с уверенностью могу сказать,что даже моя шести летняя дочь быстро приноравилась к пользованию этой площадкой.  не могу выделить минусы,так как пользуюсь этим сайтом уже долгое время и всегда остаюсь довольна услугами.",5,heroin torch17
"Впринципе сойдёт. Приложение в целом более-менее, как и множество подобных, сейчас для меня главный минус это то, что не могу понять как выбрать качество видео. Но оценка не приложению, а маркетинговой политики кампании - заявить о пробном...  Есть фильмы с русской озвучкой, подписка стоит совсем немного, хорошая картника  Нет возможности скачать, также не подсказывает как обращаться с приложением и где увеличить качество.",3,Titan1000-7
"Всё устраивает по мимо отношений между людьми одного пола Фильмы очень нравятся если не учесть тот факт что во многих фильмах идёт пропаганда ЛГБТ. Не в открытую и крупным планом, но всё же это...  Интересный сюжет, качество, спецэфекты  Пропаганда афроамериканцев и нетрадиционной отношений. ",5,Lesya0213
"Замечательный кинотеатр. Откровенно говоря, я очень довольна кинотеатром ""Netflix"". Я уже давно пользуюсь этой платформой и подпиской для просмотра фильмов и сериалов, и каждый раз она меня не разочаровывает. Одним из наибольших преимуществ ""Netflix"" является его огромный...  Множественный выбор контента на любой вкус, качество контента.  Не нашла.",5,pakovskaya
"Фильмы для души Netflix - онлайн-кинотеатр, который поможет скрасить ваши серые будни. Огромный выбор жанров от веселой комедии, до душезахватывающей мелодрамы. Отдельное внимание к детективным историям, которые позволяет на время просмотра фильма/сериала почувствовать себя помощником детектива и начать...  Большой выбор фильмов  Платная подписка, но это того стоит",5,Елизавеа
"Удобно Мне очень нравится именно этот кинотеатр потому что он очень удобный надёжный и относительно дешёвый, в отличие от остальных. Очень большой выбор фильмов и сериалов. Хочу отметить проект ""netflix anime series"" и хочу отдельно сказать...  Удобно и качественно.  Не наблюдается.",5,Даметим
"Это просто ШЕДЕВР Netflix - это один из лучших сервисов для потокового просмотра фильмов и телесериалов. Я пользуюсь этим сервисом уже несколько лет и могу сказать, что он действительно стоит своих денег. Одним из главных преимуществ является его...  много фильма, нормальная цена за подписку, каждый найдет фильм под свой вскус  есть реклама но это пустяки",5,Repotipik
"Классные, молодёжные сериалы Я очень часто смотрю сериалы на Netflix. Мне очень нравится их сериалы, фильмы. У них много интересного для подростков, можно даже сказать что они понимают молодых. Кучу сериалов я там уже пересмотрела. И могу сказать...  Много выбора, хорошее качество  Минусов нет",5,Olga-Voler
"класс Netflix - это онлайн -сервис потоковой передачи, который произвел революцию в том, как люди смотрят фильмы и телешоу. Имея более 500 титулов, есть что -то для всех. От классических фильмов до современных блокбастеров, у Netflix...  всегда есть, что посмотреть   просто нету",5,GALCHEVSKY21
"Один из лучших Очень популярный и раскрученный сервис, он по достоинству занимает наивысшее место среди сервисов. В его библиотеке всегда самые последние и популярные картины, как сериалы, так и фильмы. Качество, звук все на высоте. Удобная навигация по...  Удобство, ассортимент, качество.  Пока нет.",5,Toollins23
"Архив 81 Советую к просмотру Netflix -одна из самых лучших кинокомпаний современности ! Смотрел первый сезон сериала Архив 81 пол года назад, остался под впечатлением, для любителей временных линий очень зайдет, так как действия происходят в разных временных промежутках...  Озвучка ,локации ,актёрская игра   Не нашел для себя в этом сериале ",5,Алексей Козлобае
"Хороши сайт... Очень хороший сайт для поиска хороших фильмов, сериалов, мультфильмов. И Сюжеты есть очень хорошие мне очень нравится этот сайт советую и...  Очень много хороших актеров.  Их нет ",5,cricet19
"Обалденно, качественно, на высшем уровне Приветствую, дорогой мой читатель! Если хочешь посмотреть интересные фильмы и сериалы, с качественным музыкальным оформлением, озвучкой и шикарной картинкой, то смело заходи на «Netflix». Уже более одного года отдаю предпочтение только ему! Здесь ты найдёшь...  Качественное оформление, шикарный звук, профессиональная картинка  Нет",5,Julietta-N91
"Раньше любил смотреть. У Нетфликс много сериалов, которые являются моими любимыми. Приведу примеры: Черное зеркало, Ход королевы, Игра в кальмара, Тьма. Каждый из них, на мой взгляд, это шедевр! В каждом фильме есть идея, он помогает размышлять, задумываться...  много интересных сериалов  гомосексуализм в каждом кино",3,Альберт Шериф
"Очень крутое приложение Подписку нам подарила сестра мужа. Очень классный контент, дети освоили очень быстро. Качество отличное. Оформление доступное. Приложение очень хорошо реагирует на ваши желания и интересы. Рекомендую всем. 0+ и старше. Любой возраст найдет что посмотреть...  Просто, удобно, оперативно, качественно,   К сожалению не все телевизоры поддерживают данное приложение но если приобрести дополнительную приставку это легко исправить ",5,MiraMAV
"Удобный кинотеатр дома Вечером, в поисках фильма который тебя заинтересовал натыкался на разные сайты которые не очень удобные, пока разберёшься во всех этих сайтах можно сойти с ума, так ещё и озвучка не очень ( если это какой-нибудь...  удобно, быстро, доступно   подписки , уход",4,wonnemox
"Всегда есть что посмотреть, но так как много всего много времени уходит на аыбор Очень рад что встретил данное приложение. Посмотрел здесь ""очень странные дела"", ""Дион"", ""сквозь снег"", ""бумажный дом"", ""Анна"". Где ещё такой выбор в таком качестве найдешь? Нигде. Есть фильмы к сожалению которые на русском отсутствуют -...  Интерфейс, огромный выбор  Цена подписки, не все фильмы имеют русскую озвучку",5,aalllfff
Много интересного контента который стоит вашего внимания Я пользуюсь платформой Netflix уже три месяца. И за это время он мне очень понравился. В частности большая подборка рождественских фильмов. Которые я с радостью просматривал в эти зимние праздники. Также радует огромное количество уникальных...  Большая библиотека проектов  Озвучка всего контента ,5,maks5246
"Лучшая плотформа Для просмотра фильмов, эта платформа самая подходящая, на ней качественный и оригинальный перевод, который для многих настоящая находка, в том числе и для меня. Netflix - подходит для семейного просмотра: экшена, драммы, и т. д...  Перевод, сюжет, графика   Нужен хороший интернет ",5,daaliya
"Замечательный сервис Из всех мною ранее юзаных платформ для просмотра фильмов и сериалов, этот пожалуй самый удобный. Или как теперь принято их называть стриминговых сервисов (нахватались модных словечек). Печально что он ушел из России, но писать отзыв...  Был в России  Нет в России",5,CEOSAFAR
"Уникальный портал с сериалами и фильмами. Я очень люблю cериалы, кино, и чаще всего люблю смотреть все в оригинале, особенно на английском языке. Особенно узнать языковые фишки помогает, про которые нигде не напишут и плюсом к этому дополнительное повторение самого английского...  Удобно, недорого, все новинки в одном месте.  Плюсы перекрывают минусы, поэтому их нет ",5,DenisAbramov
"Ожидал лучшего В основном неплохой онлайн кинотеатр, но всё равно много фильмов без русского перевода. Точнее сказать большинство без русского перевода, правда последние премьеры идут с переводом. По поводу оплаты относительно не дорого как для нашего региона(...  Удобства в пользовании  Мало фильмов с русским переводом и цена",3,tyoxka41
"Самый любимый онлайн-кинотеатр Я большой любитель фильмов и сериалов, не представляю своей жизни без них. И лучшее, что я когда-либо находила это Netflix. Обычно смотрю только там и всегда довольна любой находкой в этом кинотеатре. Огромнейший выбор сериалов...  Только плюсы  нет",5,Alisha5656
"Самые крутые фильмы и сериалы здесь! Нетфликс - это всегда оригинальные и интересные подборки различных фильмов и сериалов. Если хотите найти что-то необычное - вам 100% сюда. Очень удобно, что фильмы можно скачивать и смотреть в любое время при отсутствии интернета...  Оригинальные фильмы и сериалы  Только платно",5,EkaKlok
"Один из лучших кинотеатров. Netflix является одной из лучших платформ сети. В первых приложение теперь идет на русском языке. Дата выхода в России 15 октября 2020 года. Можно посмотреть все, что угодно, а именно :фильмы, сериалы, мультфильмы, шоу, аниме...  В принципе устраивает все ,можно включать субтитры для перевода канала,можно установить детский режим для своего ребенка.  Значительных минусов отметить не могу,но советую для тестирования приложения  попробовать бесплатную подписку на 30 дней,может кому то она и не подйдет.",5,Tanya24SA
"Неплохо, можно пользоваться в России Было много сомнений, стоит ли брать подписку Нэтфликс, особенно в России. Предупрежу сразу, далеко не все имеет Российский перевод. Например, сериал Люцифер точно нет. Не самое удобное меню, постоянно вылетаешь куда-то не туда. В целом...  Качество, популярные сериалы с российской озвучкой, неплохой выбор фильмов и сериалов   Много что не имеет российской озвучки, не самое удобно и понятно меню",4,Gaarich
"Классный онлайн кинотеатр с возможностью загрузки фильмов Всем добрый день! Подписана на все онлайн кинотеатры, так уж получается, что фильмы новинки люблю, а они выходят по разным кинотеатрам. Но совсем недавно открыла для себя Netflix и понеслось - спать ложусь не раньше...  Качественное изображение, хороший подбор сериалов, возможность загрузки фильма   Цена ",5,Elena3013
"Хороший контент, но слабая русификация Netflix давно заинтересовал меня и мою семью хорошими, интересными фильмами и сериалами. Ранее фильмы и сериалы смотрели посредством других ресурсов, но вот решили попробовать пробную подписку с тем, чтобы ее продлить на полноценной платной основе...  Хорошее качество контента (фильмы, сериалы)  Малая доля русификации",4,ElanaEll
"Пожалел, что заплатил Доброго времени суток... Уважаемые друзья и жители, , отзовик, , Пересмотрел всё фильмы на ivi, (скажу одно, киномания там не густая). Решил, по совету рекламы вступить в членство... (Слово то какое), не подписка, а членство...  Ну если всё языки знать  Повсюду",1,КРИТИКjd
"Отписка ужас просто!... В самом приложение есть хорошие фильмы, но многие без русского перевода! Но в принципе, это терпимо. Возмутило вот что, отписка от приложения и возврат не использованных денежных средств. Специалист Виктория, просто в прямом смысле, издевались...  Хорошие фильмы  Сервис.  Часто нет русского перевода.",3,yfnecbr81
"Очень скромно Дважды подписывалась на Netflix в России, дольше месяца подписку не пролонгировала. Мало интересного контента на русском языке. Да, я могу смотреть прицельно кино и сериалы на английском или с субтитрами, но для меня это работа...  Уникальный контент, всегда есть оригинальная звуковая дорожка  Неудобный интерфейс, мало фильмов на русском языке",3,consmarin
"[цензура] На предложение получить 30 дней за 1 рубль, одновременно предлагают выбрать тариф и при при нажатии кнопки активировать тариф снимают 599 рублей. Парадокс, на моё требование через платёжную систему - вернуть платёж - Деньги...  нет  ужасный интерфейс даже по сравнению с ivi",3,qwerty15
"КАчество картинки и звука хорошее, но толку с того, если всё на английском . Случайно повёлся на бесплатный период. А теперь автоматом списывают 1000р за возможность смотреть фильмы на английском языке. Переключить на русский нет вариантов...  Хорошее качество картинки и звука  НЕТ возможности смотреть на русском.",1,anatol55
"Вообще не жалею о подписке Долгий и тернистый поиск в интернете, когда пытаешься найти какой-то сериал или фильм на английском языке с английскими субтитрами. Либо этого нет, либо качество хромает, либо субтитры русские. Но Netflix решил эту проблему. Помимо контента...  Качество, возможность загрузки для просмотра оффлайн  Есть не весь желаемый контент",5,sweet-dream
"Лучшее, что со мной произошло! Все наверное слышали про Нетфликс, но мало кто им пользуется. Популярность эта платформа набрала и во время карантина. очень классная платформа. На ней можно посмотреть сериалы, фильмы, мультфильмы. Можно на английском, с субтитрами, на русском...  -подбор сериалов, кино под тебя -можно подтянуть английский -нет рекламы  -их нет",5,Сарах
"Netflix - Шикарный канал! Все мы прекрасно знаем что это за компания Netflix. Просто отличный канал с огромный выбором как фильмов так и сериалов. Ну и самое главное что, они производят на мой взгляд лучшую продукцию на сегодняшней день...  Много различных новинок, качество, удобство  платный",5,JekazM
"Впринципе хороший Раньше нетфликс был одним из лучших сервисов сам смотрел игру в кальмара, годзилу, чернобыль, чёрное зеркало. Но когда началась дикая повестка тогда перестал и...  Количество фильмов, качество фильмов  ОГРОМНАЯ лгбт повестка",3,f0rmaL
