comment,rating,username
"Может быть полезным, а может и много времени съедать Пришел тот момент, когда я осознала, что смотреть фильмы/сериалы на сторонних ресурсах - все равно, что украсть. К сожалению, в постсоветских странах нет этой культуры, когда уважают авторское право и оно также надежно защищено законом...  Легальный просмотр фильмов, сериалов, выбор языка озвучки и субтитров  Может забирать много времени, если не дозировать время просмотра",5,Kiev woman
"Русским нельзя? Сам Netflix и его интерфейс очень удобен. Все понятно и просто найти. Для тех кто хочет смотреть фильмы и сериалы в оригинале – топчик! Однако вопрос – ГДЕ РУССКИЙ ЯЗЫК? Перевод большей части сериалов и...  Оригинальная озвучка, хорошее качество   Мало русского перевода ",3,nllmiii
"Слишком дорого Нетфликс - полное разочарование. Платишь за подписку, а качество контента падает. Мало новинок, зато много повторяющегося. Интерфейс запутан, поиск неэффективен. Деньги на ветер. Не...  Сериалы  цена, качество",4,lolpocv
"Сами главное нету рекламы Я очень люблю Netflix. Это удобный способ смотреть фильмы и сериалы без рекламы. Мне нравится, что они предлагают множество оригинальных шоу и фильмов, которые я больше нигде не могу найти. Кроме того, мне нравится, что...  Нет реклами  Пока не нашёл ",5,7 9969007217
"Использую часто , всем совету Качество стриминга на Netflix впечатляет меня. Я могу смотреть фильмы и сериалы в HD-качестве без какой-либо задержки или снижения качества изображения. Это позволяет мне полностью погрузиться в просмотр и насладиться кинематографическими шедеврами в наилучшем виде...  Еще одно преимущество Netflix - возможность смотреть контент на любом устройстве и в любой удобный для меня момент.   Нужно покупать подписку",4,SecretSz
"советую многим Много лет пользуюсь этим кинотеатром, быстрая оплата подписки и цена вменяемая. Огромный выбор фильмов и сериалов для любого возраста, на любой вкус! Фильмы в хорошем качестве и с отличным переводом! Много лет моя семья пользуется...  Плюсы в отзыве  Нет",5,Ляпка
"Съемка уникальных фильмов. Это был лучший видеохостинг в России. Сейчас, к сожалению, оплачиваться приходится, через друзей Казахстана. Но сейчас не об этом. Нетфликс постит всегда очень увлекательные сериалы. Так же есть подборка собственного производства сериалов. Удобный интерфейс для...  Качество, уникальный контент.  Нет",5,RitaFrolovskayay
Мои впечатления Не на все есть русская озвучка. Много багов. иногда завышенные цены мало фильмом которые можно посмотреть. субтитрам остаётся желать...  Можно скачать на телефон   Скучный выбор фильмов ,3,Unknown u
Очень круто Очень люблю фильмы от нетфликса. Я готова вечность смотреть на этой платформе. Фильмы очень классно сняты. Заставка нетфликса в начале просто любовь. Жду ещ...  Надежно смотреть  нет,5,noamill0chka
Лучший в прошлом и средний сейчас Неплохой сервис сейчас с удобным интерфейсом и большим количеством разнообразных кино с сериалами но есть альтернативы и получше. Так же есть вопросы к нынешнему качеству сериалом но на любителя...  В количестве фильмов и сериалов  В качестве этих самых фильмов и сериалов,4,Буравчик1
"Очень удобный! На данной платформе очень много достойных фильмов и сериалов, оформила подписку достаточно давно и не жалею, наоборот продлеваю ее снова и снова))Звук отменный, качество хорошее, ничего не...  Очень удобно   Не обнаружено ",5,ggghhhFdss
"обожаю эту платформу Платформа для просмотра моих любимых сериалов! Нравится разнообразие жанров и стилей собранных в этом приложении. Можно использовать на различных устройствах, что очень сильно радует. Приложение удобное, интерфейс приятный по цветовой гамме, все работает без провисаний...  удобство, интерфейс   отсутствуют ",4,xoezess
"Идеальный (за свои деньги) сервис для просмотра сериалов и фильмов Коротко. Решил попробовать сервис из-за рекомендации друзей. под мыслей что сервис мог быть фигней, я отдал свои 10 подписку, и если честно - не жалко что я их потратил. Всегда что-то свеженькое, хорошее качество. В...  Свежая подборка фильмов и сериалов, прикольный интерфейс сайта, недорого.  Никаких",5,ivanolo8009
"Очень впечатляет Я воспользовался услугой фильмов и нашел её приятной и увлекательной. Этот сервис позволил мне расслабиться и насладиться хорошими фильмами, которые были разнообразны и интересны. Благодаря этому я смог отвлечься от повседневных проблем и насладиться приятным...  Качество и звук просто впечатляет  Отсутствует",5,Yan7
Любимый онлайн кинотеатр Netflix для меня самый лучший онлайн кинотеатр. Можно найти любые фильмы на свой вкус. И что хорошо там очень легко и удобно. Новинки всегда на главной странице. Я всегда предпочитаю смотреть свои любимые дорамы и...  Легко можно ориентироваться   Я их не вижу,5,Mika Sh
"Потрясающее! Обожаю нетфликс, вообще компанию. Конечно есть некоторые сериалы не оченьские, но в основном очень хороший сбор фильмов/сериалов/аниме/дорам. Кому что нравится, можете все найти...  Хорошее качество!!  Возникали проблемы с подключением, но с экспертом своего дела.",5,brmqnq
"Крутые фильмы и сериалы К данной платформе я пришёл не сразу, но не пожалел, так как мне нравятся фильмы и сериалы от Netflix, а здесь я получил доступ к множеству фильмов и...  Много интересного  Отсутствуют",5,NickRun
"То, что нужно! Интересно и удобно. Само название Netflix говорить должно само за себя. Это очень удобный сервис. Все самое новое интересное и рейтинговое только здесь! Это не реклама, а своё мнение о пользовании 2-х летнем. Тут и сериалы, которые только...  Качество, контент, премиум .  Проблемы в России. Немного дороговато.",4,Frist74
"Netfix"" - стал для меня одним из лучших онлайн-кинотеатров. Netflix"" является одной из лучших платформ. Узнав, что приложение официально стало русскоязычным, я как был очень удивлен и очень счастлив. Во-первых, потому что искали замену онлайн-кинотеатру ""Иви"". Во-вторых, большая часть нашей ""кинотеки"" состояла из проектов...  Удобная, огромный выбор фильмов и сериалов  Нет",5,Dmitriy1996so
"Отлично Смотрим с мужем много фильмов и мультфильмов от нетфликс. Раньше было не интересно, но муж порекомендовал. Попадались интересные фильмы, которые я раньше не...  Нравится   Пока нету",5,Bssa5258
"Мне нравится! Очень удобное приложение. Множество доступных сериалов и фильмов, правда нужно подписаться, но это того стоит. В общем рекомендую. Не нужно сидеть и вспоминать что хотел посмотреть, просто выбрал жанр, пролистал и посмотрел. Тем более все...  Есть что посмотреть по подписке , всегда новинки, любой жанр, удобно искать, удобный интерфейс,  можно выбрать на любых других языках.  Минусы что не все фильмы и сериалы в бесплатном доступе, в доступе старые фильмы которые не очень интересны.",5,Kirayza
"отличное предложение Пользуюсь онлайн-кинотеатром уже больше полгода. Очень удобно, отличные фильмы. Все в отличном качестве. Простой интерфейс. Рекомендую для просмотра фильмов...  очень много плюсов  нет",5,ruzmar2518
"Что у нас на вечер? Суперский онлайн кинотеатр с обширным доступом. Я очень люблю посмотреть сериал вечерочком, тут на любой вкус выбирай что хочешь. К сожалению из-за санкций доступа из РФ нет. Поражает как красиво снято. как переданы те или...  Обширное количество сериалов  нет",5,Alison Lisa
"Очень нравиться Очень нравиться этот сервис и сериалы, которые снимают нетфликс. Им последнего что смотрел ведьмак» второй сезон. Всем рекомендую. Очень легко в...  Очень качественно   Для меня нет минусов ",5,Dubamax
"Самый популярный онлайн кинотеатр Вы можете найти самые новые и популярные фильмы с этого онлайн кинотеатра и посмотреть со всей семьёй! Ещё можете найти сериалы которые сняли именно от этого...  Очень удобный онлайн сайт чтобы посмотреть вчерком с детьми фильмы не входя из дома ! Сидя в диване с горячем кофе или с чаем   Могут быть рекламы и сайт иногда работает медленно это связано с интернетом конечно,мне кажется надо поработать эти минусы, а так не плохой сайт ",5,Zarnigoraa
"Прекрасная платформа Я люблю смотреть разные сериалы и т. п. Знакомые посоветовали онлайн-кинотеатр Netflix. Оформила подписку и не зря. Огромный выбор фильмов, сериалов и мультфильмов. Посмотрела сериал ""Ходячие мертвецы"" качество просто супер, а звук это что-то. Всё...  Качество фильмов   нету",5,Кваи
"Удобное использование и многообразие контента Каждый вечер смотрю сериалы и фильмы в данном онлайн-кинотеатре. Все сериалы, которые я уже посмотрела, наполнены захватывающей эстетикой и интересным сюжетом. Очень нравится, что есть разные подборки, которые помогают выбрать то, что больше подойдёт по...  Удобство, интересные фильмы и сериалы   нет",5,yasashka
"Мне понравилось В целом, Netflix - это отличный выбор для любителей фильмов и сериалов, предлагающий широкий выбор высококачественного контента, удобную навигацию и персонализированные...  Качество видео на Netflix заслуживает похвалы. Они предлагают высокое качество видеостриминга с различными вариантами разрешения, включая HD и Ultra HD, в зависимости от доступного интернет-соединения и устройства, на котором вы смотрите.  Однако, стоит отметить, что каталог Netflix может различаться в разных странах, и некоторые фильмы и сериалы могут быть недоступны в вашем регионе.",5,slZAGIM
"В целом круто В целом, Netflix является популярной и известной платформой для стриминга видеоконтента. Он предлагает широкий выбор контента, удобство использования и высокое качество просмотра. Однако, как и у любой другой платформы, у него есть свои ограничения и...  Оригинальный контент  Платные подписки",5,Best060506
"То что нужно народу Netflix это компания которая выпускает продукт качественный, свежий их проекты это то что нравится обществу и подходит для всех типов зрителя. Что касается данной платформы это удобный доступный и понятный сайт облегчающий и улучшающий доступ...  Удобство, понятное и легкое управление, быстрый доступ   Не имеется",5,Ilya055
"Лучшее что есть. Первое, что бросается в глаза, это обширная коллекция фильмов, сериалов и документальных проектов. От легендарных хитов до уникальных инди-проектов – здесь каждый найдет что-то, что зацепит его воображение. И то, как Netflix группирует контент по...  Тут одни плюсы во всём.  Их для меня нет.",5,thears
"Очень нравится Почти 3 года пользуюсь подпиской, там очень много фильмов и сериалов. Всегда выходит очень много фильмов и сериалов очень сильно нравится смотреть хорошее качество. Звук тоже хороший во всех фильмах. Очень сильно нравится И очень...  Все нравится   Нет минусов ",4,sofiadavidan34
"Интересные фильмы и сериалы Наверное многим Netflix очень нравится, как и мне. Здесь можно найти фильмы и сериалы на любой вкус ( от ужасов до мелодрам) Здесь можно выбрать три категории оплаты за подписку: Базик, Стандарт и Премиум. Я...  Качество, озвучка, удобный формат кинотеатра  Нет",5,Dina1406
"Лучшее. Считаю, наверное, что это лучший из кинотеатров. Фильмов много, причём любимых, озвучка у них тоже отпад! Нетфликс каждый раз радует новыми...  Удобно, минимум рекламы.  Не нашла.",5,Kieran4627
"Netflix предоставляет широкий выбор кино и сериалов для потребителей, что делает его наиболее популярным сервисов. Очень довольна сервисом Netflix! Огромный выбор фильмов и сериалов, всегда есть что посмотреть. Удобный интерфейс, легко найти нужное, быстро загружается. Мне нравится, что можно создавать списки просмотра и продолжать просмотр с того места, где остановилась...  огромный выбор сериалов и фильмов  есть возможность скачивать фильмы   не замечала ",5,Nastyukhinskaya
"Если говорить или писать кратко , то это однозначно любовь )) NETFLIX привлёк одним из очень интересных сериалов «Бумажный дом» и ещё одним не менее интересным фильмом «Люпен» однозначно рекомендую к просмотру. После просмотра этих фильмов, netflix стал просто любимым онлайн-кинотеатром нашей семьи...  Множество фильмов и сериалов , разнообразие , качество потрясное   Не нашла ",5,Ali0707
"Очень клёвое приложение Пользуюсь этим приложением уже год, и особо впечатления этим приложением много курить фильмов и сериалов, ну есть один минус иногда забываю отключили автоплатеж и списываются...  Очень хорошее приложение   Автоплатеж",4,Rafarq
"Лучшая платформа с фильмами и тд! Я недавно начал пользоваться Netflix и уже могу сказать, что это одно из лучших приложений для просмотра фильмов и сериалов. Огромный выбор контента, возможность создавать свои списки любимых фильмов и сериалов, а также удобный интерфейс...  Очень удобная и понятная  тяжело пользоваться в России",5,Кирилл 3131
"Крайне негативное Расиссткий сервис, который ничего хорошего не выпустил и не выпустит, сугубо пропаганда западных ценностей и ненависти к славянским народам. Не качественный кинематограф если очень...  Никаких  Разжигание ненависти к славянским народам",1,Krisltall1
"Netflix - это отличный онлайн-кинотеатр Как мужчина, я могу сказать, что Netflix - это отличный онлайн-кинотеатр, который предлагает огромное количество фильмов и сериалов на любой вкус. Я вполне доволен этим сервисом и могу рекомендовать его всем, кто любит смотреть фильмы...  Удобный интерфейс   Ушел из России  ",4,vova911
Я фанатка Здравствуйте читали отзовика. Я давный фанатка Netflix. Их сериалы фильмы и мультфильмы превосходят мои ожидания чаще всего. Так же мне нравится создатели не забывают о коротких сериалах и делают их захватывающими. Одним словом...  Новики  Нет нет нет,5,Romshca
"Не доволен Большинство интересующих меня сериалов идут на английском языке с русскими субтитрами. За что тогда платить такие суммы? Проще скачать сериал на торенте или посмотреть онлайн, по крайней мере будет с русской озвучкой. Лично мне такой...  Удобный интерфейс  Нет русского перевода у многих сериалов",3,Suetin
"Простой в использовании Очень удобный в использовании, огромнейшая библиотека фильмов и сериалов, отличный проигрыватель со всеми нужными функциями, Хорошее качество звука и...  Удобно и просто  Не обнаружил ",5,Nutsik98
"Топ Идеальный сайт, чтоб отлично провести время, всем советую, нету никаких лагов и проблем, очень удобный интерфейс, буду дальше смотреть фильмы и...  Очень удобный интерфейс, ничего не лагает, всем могу уверенно посоветовать Netflix!  Конечно минусы есть в каждом приложении, но в этом я не нашёл абсолютно никаких",5,Dmitriy9119
Идеальное решение Очень удобный кинотеатр. Можно посмотреть все новинки интересных сериалов. Качество изображения и звук на высоте. Пока не нашла более подходящего для меня...  Качество  Не обнаружила ,5,Dinasdivana
"Отличный сервис для просмотра фильмов. Очень хорошие, качественные фильмы и сериалы можно смотреть на данном сервисе. Большой выбор фильмов и сериалов разного жанра. Для детей также большой выбор для...  Качество,увлекательно   Нет",5,dgonny2212
